Meme ID,Template Name,Original (English),Translation
225,confused muslim girl,When Mr. Greene talks... <sep> What does that even mean?!,When Mr. Greene talks... <sep> What does that even mean?!
199,arabic meme,Alalalalalalallaah <sep> Thats the sound after masoud nuts in sultans sweet ass,Alalalalalalallaah <sep> Thats the sound after masoud nuts in sultans sweet ass
115,troll asian,I'm pretty damn happy <sep> about football,I'm pretty damn happy <sep> about football
60,asian college freshman,"oh shit, ribs on special <sep> diet starts tomorrow guys","oh shit, ribs on special <sep> diet starts tomorrow guys"
36,stereotypical indian telemarketer,when i try to duplicate your issue <sep> i get 'out of memory' error.,when i try to duplicate your issue <sep> i get 'out of memory' error.
47,privilege denying feminist,quit leaving the toilet seat up <sep> women use it down so you must put it down,quit leaving the toilet seat up <sep> women use it down so you must put it down
186,feministfrequently,I had a friend that got almost raped <sep> your argument is invalid,I had a friend that got almost raped <sep> your argument is invalid
53,privilege denying tranny,abortion? a womans issue? <sep> transmen need abortions too!,abortion? a womans issue? <sep> transmen need abortions too!
26,black kid,HOW I FEEL <sep> WHEN THE KIDS ARE ASLEEP,HOW I FEEL <sep> WHEN THE KIDS ARE ASLEEP
105,feministfrequently,no im not going in the kitchen <sep> can you help open this jar for me?,no im not going in the kitchen <sep> can you help open this jar for me?
289,angry muslim guy,It's racist to call me a goat humper <sep> Even though I hump goats,It's racist to call me a goat humper <sep> Even though I hump goats
205,scumbag police officer,Cops... <sep> Only laugh at their own jokes,Cops... <sep> Only laugh at their own jokes
265,privilege abusing white couple,Quality men believe in equality of women <sep> ,Quality men believe in equality of women <sep> 
98,strict policeman,Now where did she touch you <sep> think carefully it could be the last thing you ever say,Now where did she touch you <sep> think carefully it could be the last thing you ever say
58,advicejew,yeah yeah merry chrismas <sep> now bring me my free shit,yeah yeah merry chrismas <sep> now bring me my free shit
29,generic indian guy,you picked a good day to work from home... <sep> no one's here except me Kevin and Yaji !!!,you picked a good day to work from home... <sep> no one's here except me Kevin and Yaji !!!
171,germany pls,winter too cold <sep> summer too hot,winter too cold <sep> summer too hot
234,jewish dude,simmons <sep> is a good brother to us and loyal to our agendas,simmons <sep> is a good brother to us and loyal to our agendas
3,skeptical black kid,So you're telling me <sep> that Macbeth actually trusted three random witches.,So you're telling me <sep> that Macbeth actually trusted three random witches.
66,troll asian,"dad told me to be a doctor, so i did <sep> in anthropology","dad told me to be a doctor, so i did <sep> in anthropology"
97,obese american,There's nothing wrong with the way i look <sep> It's todays society that's wrong,There's nothing wrong with the way i look <sep> It's todays society that's wrong
123,sassy black woman,BRING ME TO MCDONALDS <sep> BEFORE I BEAT YOU,BRING ME TO MCDONALDS <sep> BEFORE I BEAT YOU
194,oppressive trans bro,TRANS WOMEN <sep> GET MORE MEDIA REPRESENTATION THAN I DO,TRANS WOMEN <sep> GET MORE MEDIA REPRESENTATION THAN I DO
125,sassy black woman,"DO NOT, <sep> STOP THIS TRUCK!","DO NOT, <sep> STOP THIS TRUCK!"
150,condescending christian,incredibly sexy <sep> equally annoying,incredibly sexy <sep> equally annoying
10,american pride eagle,took your LANGUAGE and improved it <sep> you are welcome,took your LANGUAGE and improved it <sep> you are welcome
15,sassy black woman,IVY <sep> 30 YEARS LATER,IVY <sep> 30 YEARS LATER
280,muslim immigrant,muslim does not equal to terroism <sep> we need peace with muslims,muslim does not equal to terroism <sep> we need peace with muslims
74,advicejew,my name is <sep> tony,my name is <sep> tony
145,typical germany lover,Hitler <sep> did nothing wrong,Hitler <sep> did nothing wrong
146,like a jew,Gets brilliant idea for a sequal <sep> someone loses schindler's list,Gets brilliant idea for a sequal <sep> someone loses schindler's list
214,y u so arab,who's SHOCKED <sep> by the RACISM ??,who's SHOCKED <sep> by the RACISM ??
122,y u so arab,father <sep> why do you not stop yelling at me,father <sep> why do you not stop yelling at me
14,sassy black woman,WHEN PEOPLE LEAVE THE DOOR OPEN <sep> OH NO YOU DIDNT !,WHEN PEOPLE LEAVE THE DOOR OPEN <sep> OH NO YOU DIDNT !
227,privilege denying feminist,there's no shame in nude photos <sep> stop humiliating women by releasing their nude photos,there's no shame in nude photos <sep> stop humiliating women by releasing their nude photos
191,mexicanotriste,Why would you <sep> eat my Guacamole?,Why would you <sep> eat my Guacamole?
140,condescending christian,fewer people coming to church. <sep> blames atheists.,fewer people coming to church. <sep> blames atheists.
116,troll asian,Asian Jerry asks where you go to create a meme <sep> uses it against you...such an asshole!,Asian Jerry asks where you go to create a meme <sep> uses it against you...such an asshole!
192,privilege denying feminist,"society's Gender roles are ignorant and wrong! <sep> tells you to ""man up and grow some balls""","society's Gender roles are ignorant and wrong! <sep> tells you to ""man up and grow some balls"""
121,transvestite trevor,don't worry <sep> i can be nathan too,don't worry <sep> i can be nathan too
252,good chinese student,im lizzie <sep> it was my birthday and ill milk it for all its worrth,im lizzie <sep> it was my birthday and ill milk it for all its worrth
155,privilege denying tranny,"surprise! <sep> geoff monday through friday, but georgia on the weekends","surprise! <sep> geoff monday through friday, but georgia on the weekends"
294,nia china,When you look back in life <sep> and you feel fulfilled,When you look back in life <sep> and you feel fulfilled
100,mexicanotriste,WHY DO I HAVE A .. <sep> BABY DICK,WHY DO I HAVE A .. <sep> BABY DICK
68,asian college freshman,My sister took 4 years to graduate high school <sep> i will not shame the family like her,My sister took 4 years to graduate high school <sep> i will not shame the family like her
63,good chinese student,"oh no i need to pay my hospital bills <sep> joke, canada has free universal health care!","oh no i need to pay my hospital bills <sep> joke, canada has free universal health care!"
220,confused muslim girl,When Crosby gets shot and you're not even invited <sep> ,When Crosby gets shot and you're not even invited <sep> 
293,nia china,"athletic scholarship this, athletic scholarship that <sep> who's really getting paid here?","athletic scholarship this, athletic scholarship that <sep> who's really getting paid here?"
285,obese american,hates big government <sep> collects disability benefits,hates big government <sep> collects disability benefits
178,indian father,how dare you... <sep> Krishna is not to be mocked,how dare you... <sep> Krishna is not to be mocked
114,transvestite trevor,IT'S A TRAP!!! <sep> ,IT'S A TRAP!!! <sep> 
73,typical germany lover,hears friend mention germany <sep> bore friend to death with info about germany,hears friend mention germany <sep> bore friend to death with info about germany
17,sassy black woman,YOU AIN'T GETTIN' NO FRIED CHICKEN <sep> TILL' YOU FINISH ALL  YOUR COOL-AID,YOU AIN'T GETTIN' NO FRIED CHICKEN <sep> TILL' YOU FINISH ALL  YOUR COOL-AID
13,american pride eagle,SEES COMMENTS ON YOUTUBE VIDEO OF NON-SPEAKING ENGLISH COUNTRY <sep> ENGLISH PLEASE,SEES COMMENTS ON YOUTUBE VIDEO OF NON-SPEAKING ENGLISH COUNTRY <sep> ENGLISH PLEASE
120,condescending christian,Things aren't going our way <sep> help! we're being persecuted!!!,Things aren't going our way <sep> help! we're being persecuted!!!
185,richarabclap,MANCHESTER CITY <sep> A LOCAL CLUB FOR LOCAL FANS,MANCHESTER CITY <sep> A LOCAL CLUB FOR LOCAL FANS
27,black kid,THIS IS ME <sep> WHEN I HEARD YOUR BROTHER IS SINGLE,THIS IS ME <sep> WHEN I HEARD YOUR BROTHER IS SINGLE
241,mexicans on a truck,kerry transporting <sep> America's newest arrivals,kerry transporting <sep> America's newest arrivals
210,oppressive trans bro,Don't like what you see? <sep> Don't bend over in front of me,Don't like what you see? <sep> Don't bend over in front of me
271,privilege abusing white couple,I love you so much I put you in my <sep> long term memory,I love you so much I put you in my <sep> long term memory
106,jewish dude,not getting abused by reddit <sep> feels discriminated against,not getting abused by reddit <sep> feels discriminated against
132,privilege abusing white couple,friends a black man on facebook <sep> he seems very articulate,friends a black man on facebook <sep> he seems very articulate
87,strict policeman,You have the right to remain silent <sep> Everything you say can an will be turned into a meme,You have the right to remain silent <sep> Everything you say can an will be turned into a meme
109,feministfrequently,"If you can't outargue a Man <sep> Just scream about ""Privilege.""","If you can't outargue a Man <sep> Just scream about ""Privilege."""
46,angry muslim guy,God is allmighty <sep> But I'll beat the wife myself,God is allmighty <sep> But I'll beat the wife myself
275,scumbag catholic priest,Show your hate for healthy sex <sep> Become a priest today!,Show your hate for healthy sex <sep> Become a priest today!
255,mexicans on a truck,carpooling to Vegas <sep> For jaime's birthday,carpooling to Vegas <sep> For jaime's birthday
62,typical germany lover,adolf hitler <sep> was austrian,adolf hitler <sep> was austrian
137,american flag shotgun guy,Guess what <sep> its veterans day,Guess what <sep> its veterans day
207,transvestite trevor,So you admit <sep> To wearing women's clothing,So you admit <sep> To wearing women's clothing
49,asian college freshman,Indians are asian?! <sep> Since When?,Indians are asian?! <sep> Since When?
94,asian college freshman,can't think of what to reply.. <sep> *goes offline*,can't think of what to reply.. <sep> *goes offline*
19,successful mexican,I PASSED THE BORDER <sep> THATS WHY IM HAPPY,I PASSED THE BORDER <sep> THATS WHY IM HAPPY
235,policeman,The largest street gang <sep> in America,The largest street gang <sep> in America
200,mexicans on a truck,Heading to Ellie's <sep> Who's coming?,Heading to Ellie's <sep> Who's coming?
166,scumbag catholic priest,Avoids meat as a sacrifice during Holy week <sep> Eats seafood that taste better than meat,Avoids meat as a sacrifice during Holy week <sep> Eats seafood that taste better than meat
9,american pride eagle,"Support Our Troops, Motherfucker! <sep> Or we'll lock your ass up for tax evasion!!!","Support Our Troops, Motherfucker! <sep> Or we'll lock your ass up for tax evasion!!!"
82,y u so arab,Hey syrian guy <sep> y u post a picture of me but not a picture of you?,Hey syrian guy <sep> y u post a picture of me but not a picture of you?
77,like a jew,I'll give you a hint <sep> The matzah is in my pants,I'll give you a hint <sep> The matzah is in my pants
168,mexicanotriste,the look on our faces <sep> when mr.mwai stole another lesson,the look on our faces <sep> when mr.mwai stole another lesson
79,stern but honest chinese guy,COMMUNISM <sep> UNABLE TO ACHIEVE DREAMS - BEING BORN IN THE WRONG FAMILY,COMMUNISM <sep> UNABLE TO ACHIEVE DREAMS - BEING BORN IN THE WRONG FAMILY
111,bad advice asian,bring your dog <sep> we have chicken?,bring your dog <sep> we have chicken?
20,successful mexican,MINORITY <sep> NOT AT METRO TECH!!,MINORITY <sep> NOT AT METRO TECH!!
35,generic indian guy,QUICK GIVE ME SOME <sep> CURRY!!!,QUICK GIVE ME SOME <sep> CURRY!!!
274,jesus christ,liberals <sep> bigger losers than cnn's tv ratings,liberals <sep> bigger losers than cnn's tv ratings
248,scumbag catholic priest,Catholic church <sep> protecting pedo priests for 500 years,Catholic church <sep> protecting pedo priests for 500 years
260,mexicans on a truck,Headed to your house Cesar.. <sep> HAPPY BIRTHDAY HOMIE!!!,Headed to your house Cesar.. <sep> HAPPY BIRTHDAY HOMIE!!!
81,stereotypical indian telemarketer,"technical support, <sep> this is karan speaking","technical support, <sep> this is karan speaking"
282,policeman,Freeze! You're under arrest <sep> For producing non accessible material,Freeze! You're under arrest <sep> For producing non accessible material
4,skeptical black kid,so you felt depressed <sep> because you were too fat?,so you felt depressed <sep> because you were too fat?
256,white power problems,Aryan <sep> Never celebrated Nowruz,Aryan <sep> Never celebrated Nowruz
93,nice white girl,but jennifer lawrence was <sep> such a great katniss!,but jennifer lawrence was <sep> such a great katniss!
33,generic indian guy,SHUT UP OSAMA! <sep> HE IS MY SON!,SHUT UP OSAMA! <sep> HE IS MY SON!
266,good chinese student,chinese students <sep> they are everywhere,chinese students <sep> they are everywhere
226,arabic meme,Reeks of curry <sep> ,Reeks of curry <sep> 
188,indian father,If at first you don't succeed <sep> Don't come home,If at first you don't succeed <sep> Don't come home
209,white power problems,this man <sep> does not own a mirror,this man <sep> does not own a mirror
153,privilege denying feminist,if a man is raped <sep> his body can shut that thing down,if a man is raped <sep> his body can shut that thing down
195,oppressive trans bro,When I Grow Up <sep> I want to be a drag queen,When I Grow Up <sep> I want to be a drag queen
43,like a jew,have a shitty name <sep> like a jew,have a shitty name <sep> like a jew
287,angry muslim guy,When you realize <sep> That was you car,When you realize <sep> That was you car
124,sassy black woman,SHUT YOUR <sep> MOUTH,SHUT YOUR <sep> MOUTH
71,stereotypical indian telemarketer,invites friend to a game night <sep> starts playing single player,invites friend to a game night <sep> starts playing single player
144,troll asian,Says he cant play a game <sep> Asian,Says he cant play a game <sep> Asian
230,arabic meme,"whats for dinner? goat? <sep> wait, where's my wife???","whats for dinner? goat? <sep> wait, where's my wife???"
32,generic indian guy,STANLEY I COULD EAT YOU FOR BREAKFAST <sep> LUNCH AND DINNER,STANLEY I COULD EAT YOU FOR BREAKFAST <sep> LUNCH AND DINNER
243,angry muslim guy,Happy <sep> New year!!!,Happy <sep> New year!!!
173,like a jew,can't watch porn <sep> bans the internet,can't watch porn <sep> bans the internet
159,stern but honest chinese guy,America hates communism so much <sep> that it has borrowed 2 trillion from china,America hates communism so much <sep> that it has borrowed 2 trillion from china
7,skeptical black kid,so you're telling me <sep> you already adjusted our grades,so you're telling me <sep> you already adjusted our grades
196,y u so arab,I heard there is a hijack <sep> am i too late?,I heard there is a hijack <sep> am i too late?
212,typical germany lover,KEEP CALM AND <sep> WATCH GERMANY WIN!!,KEEP CALM AND <sep> WATCH GERMANY WIN!!
59,asian college freshman, <sep> I don't see a problem here, <sep> I don't see a problem here
80,stern but honest chinese guy,MAO OUR GREAT HERO <sep> KILLED 40-70 MILLION OF HIS OWN PEOPLE,MAO OUR GREAT HERO <sep> KILLED 40-70 MILLION OF HIS OWN PEOPLE
102,mexicanotriste,Did manual labor today <sep> Reminded me of you.,Did manual labor today <sep> Reminded me of you.
30,generic indian guy,jason needs some brownie mix <sep> steven never texted him,jason needs some brownie mix <sep> steven never texted him
21,successful mexican,My name is emmanuel <sep> i mow your lawn $.50,My name is emmanuel <sep> i mow your lawn $.50
170,bad advice asian,you never see <sep> stray cat in chinatown,you never see <sep> stray cat in chinatown
18,successful mexican,I come to <sep> tend your garden,I come to <sep> tend your garden
40,stereotypical indian telemarketer,"I do have your customer on the other line... <sep> Thank you for patiently holding, mr. derp","I do have your customer on the other line... <sep> Thank you for patiently holding, mr. derp"
197,scumbag police officer,"I know the lay better then you <sep> ""now bend over""","I know the lay better then you <sep> ""now bend over"""
104,success germany,lend greece own taxpayer money <sep> STILL GET CALLED A NAZI,lend greece own taxpayer money <sep> STILL GET CALLED A NAZI
139,feminist cunt,Sexually harassed by group of black guys <sep> blames the white male patriarchy,Sexually harassed by group of black guys <sep> blames the white male patriarchy
148,jewish dude,have you ever been <sep> with a jew?,have you ever been <sep> with a jew?
108,strict policeman,fun police <sep> be friends and kiss,fun police <sep> be friends and kiss
161,transvestite trevor,TOMMY. <sep> ON SATURDAYS,TOMMY. <sep> ON SATURDAYS
176,germany pls,Interviewer has weak handshake <sep> Not sure what to do,Interviewer has weak handshake <sep> Not sure what to do
154,jesus christ,no where in the bible was there any homosexuality <sep> god does not support gays in the slighest,no where in the bible was there any homosexuality <sep> god does not support gays in the slighest
38,advicejew,Call your mother <sep> so she can complain about your lack of calls,Call your mother <sep> so she can complain about your lack of calls
119,white power problems,THINKS JUDAISM <sep> IS A RACE,THINKS JUDAISM <sep> IS A RACE
169,condescending christian,muslims are bad <sep> because the bible is good,muslims are bad <sep> because the bible is good
162,privilege denying feminist,porn is disgusting and sexist <sep> so the stuff I like isn't porn,porn is disgusting and sexist <sep> so the stuff I like isn't porn
193,privilege denying feminist,A man had some sort of emotion? <sep> time to belittle it and declare it misogynist,A man had some sort of emotion? <sep> time to belittle it and declare it misogynist
292,nia china,I am the king of china <sep> Inventer of vagina,I am the king of china <sep> Inventer of vagina
99,condescending christian,"I respect your views <sep> ""want to come to my youth group?""","I respect your views <sep> ""want to come to my youth group?"""
269,muslim immigrant,just in time <sep> for new year in cologne,just in time <sep> for new year in cologne
175,sassy black woman,"Gets monthly food stamps from state, <sep> spends them on $10.99 a pound steaks","Gets monthly food stamps from state, <sep> spends them on $10.99 a pound steaks"
113,stern but honest chinese guy,You are good at the olympics <sep> but terrible at money management.,You are good at the olympics <sep> but terrible at money management.
203,muslim immigrant,africa for the africans asia for the asians <sep> white countries for everyone !,africa for the africans asia for the asians <sep> white countries for everyone !
278,feminist cunt,you're recording <sep> you better not put this on youtube,you're recording <sep> you better not put this on youtube
134,american flag shotgun guy,ON THE SEVENTH DAY <sep> GOD CREATED THE RIFLE,ON THE SEVENTH DAY <sep> GOD CREATED THE RIFLE
135,bad advice asian,one kilo of chicken wings. <sep> ,one kilo of chicken wings. <sep> 
42,angry muslim guy,stop! <sep> my beard tickles!,stop! <sep> my beard tickles!
251,arabic meme,How exciting I just met <sep> Our 12 year old daughter's husband to be,How exciting I just met <sep> Our 12 year old daughter's husband to be
245,oppressive trans bro,I got raped and got pregnant <sep> but i identify as male so its allright... also charmingly excentric,I got raped and got pregnant <sep> but i identify as male so its allright... also charmingly excentric
89,strict policeman,i hate black people <sep> thats why i got a job with a gun,i hate black people <sep> thats why i got a job with a gun
295,nia china,When your girlfriend knows your cycle <sep> and brings you a cooling kit,When your girlfriend knows your cycle <sep> and brings you a cooling kit
238,mexicans on a truck,Jose's family <sep> Going on a trip,Jose's family <sep> Going on a trip
164,privilege denying feminist,women are an oppressed minority <sep> asians are not,women are an oppressed minority <sep> asians are not
90,troll asian,one does not simply <sep> press the toilet flush,one does not simply <sep> press the toilet flush
69,troll asian,EXpected by group members to do majority of work <sep> doesn't do anything,EXpected by group members to do majority of work <sep> doesn't do anything
218,richarabclap,i'm so happy we have kids <sep> to blow up,i'm so happy we have kids <sep> to blow up
288,jesus christ,it looks like <sep> my presence is required here,it looks like <sep> my presence is required here
179,indian father,ME <sep> 30 YEARS FROM NOW?,ME <sep> 30 YEARS FROM NOW?
298,muslim immigrant,when the bomb goes off too early <sep> ALLAH YOU CUNTTTTT,when the bomb goes off too early <sep> ALLAH YOU CUNTTTTT
138,american flag shotgun guy,SOUTH WILL <sep> RISE AGAIN,SOUTH WILL <sep> RISE AGAIN
180,angry muslim guy,SEES UNACCEPTABLE MUSLIM MEME <sep> WISHES THEY COULD PROVIDE A BETTER MEME IN RESPONSE,SEES UNACCEPTABLE MUSLIM MEME <sep> WISHES THEY COULD PROVIDE A BETTER MEME IN RESPONSE
242,scumbag catholic priest, <sep> it's not inappropriate when I touch you there, <sep> it's not inappropriate when I touch you there
118,obese american,Are you going to <sep> eat that flag?,Are you going to <sep> eat that flag?
103,jesus christ,yolo? <sep> never heard of it,yolo? <sep> never heard of it
39,jesus christ,I don't have the answers to everything. <sep> Ask google.,I don't have the answers to everything. <sep> Ask google.
182,richarabclap,lets stop sending money to foreigners <sep> and use that money to send every american to yale,lets stop sending money to foreigners <sep> and use that money to send every american to yale
156,y u so arab,ARAB FRIEND <sep> CHRIS,ARAB FRIEND <sep> CHRIS
101,stern but honest chinese guy,I say i'm good at handball <sep> But when i tried out for the team i didn't make it,I say i'm good at handball <sep> But when i tried out for the team i didn't make it
233,jewish dude,you shall not <sep> access your favorite websites,you shall not <sep> access your favorite websites
70,obese american,jogs for exercise... <sep> from her bed to the fridge,jogs for exercise... <sep> from her bed to the fridge
211,feministfrequently,Complains that women are underrepresented in STEM fields <sep> Gets a degree in women's studies,Complains that women are underrepresented in STEM fields <sep> Gets a degree in women's studies
219,feministfrequently,Be angry on the internet! <sep> It will change things in real life!,Be angry on the internet! <sep> It will change things in real life!
84,nice white girl,but my dreamcatcher tattoo <sep> honors native culture!,but my dreamcatcher tattoo <sep> honors native culture!
83,nice white girl,why can't i <sep> use the n word?,why can't i <sep> use the n word?
215,white power problems,has difficulty finding work in retail <sep> blames reverse discrimination,has difficulty finding work in retail <sep> blames reverse discrimination
64,asian college freshman,father says to marry his 3rd cousine <sep> actually does it,father says to marry his 3rd cousine <sep> actually does it
237,scumbag police officer,Join the police force! <sep> Kill unarmed kids and get paid vacations!,Join the police force! <sep> Kill unarmed kids and get paid vacations!
86,privilege denying tranny,HAS to put up with unfunny memes <sep> ridiculing her gender identity,HAS to put up with unfunny memes <sep> ridiculing her gender identity
160,bad advice asian,"look at this... <sep> the moon, not my finger","look at this... <sep> the moon, not my finger"
240,richarabclap,Let's become one... <sep> One israel,Let's become one... <sep> One israel
276,policeman,"Actually, Facebook does <sep> Have rules on grammar...","Actually, Facebook does <sep> Have rules on grammar..."
187,arabic meme,5 goats and 2 cows.. <sep> I have many sons.,5 goats and 2 cows.. <sep> I have many sons.
61,troll asian,how you doing? <sep> ,how you doing? <sep> 
96,feminist cunt,"i hate men! <sep> GOD, i NEED A GUY'S COCK RIGHT NOW...","i hate men! <sep> GOD, i NEED A GUY'S COCK RIGHT NOW..."
174,germany pls,showed this blog to my non-german friends <sep> they don't get it,showed this blog to my non-german friends <sep> they don't get it
1,skeptical black kid,Hmmm... <sep> Fried chicken you say,Hmmm... <sep> Fried chicken you say
208,scumbag police officer,tough drugs laws aren't working <sep> so it only makes sense if we make the laws TOUGHER,tough drugs laws aren't working <sep> so it only makes sense if we make the laws TOUGHER
157,white power problems,I ASKED A JEWISH GIRL FOR HER NUMBER <sep> SHE ROLLED UP HER SLEEVES,I ASKED A JEWISH GIRL FOR HER NUMBER <sep> SHE ROLLED UP HER SLEEVES
107,strict policeman,i dont always beat teenagers <sep> but when i do my FAVORITEs are ones named mike manol,i dont always beat teenagers <sep> but when i do my FAVORITEs are ones named mike manol
54,privilege denying tranny,the birth of the baby jesus was a queer party <sep> all the dudes wore dresses!,the birth of the baby jesus was a queer party <sep> all the dudes wore dresses!
95,success germany,How to get France and England mad at you <sep> in two easy steps,How to get France and England mad at you <sep> in two easy steps
57,stereotypical indian telemarketer,call help desk <sep> can't understand them,call help desk <sep> can't understand them
5,skeptical black kid,so your telling me <sep> the egyptians just left,so your telling me <sep> the egyptians just left
133,privilege abusing white couple,trouble making the mortgage payment <sep> i left my checkbook at home,trouble making the mortgage payment <sep> i left my checkbook at home
24,black kid,MITT ROMNEY <sep> IS GAY,MITT ROMNEY <sep> IS GAY
