Meme ID,Template Name,Original (English),Translation
2,skeptical black kid,So if i treat women like shit <sep> i will do better with them? Cool!,So if i treat women like shit <sep> i will do better with them? Cool!
281,angry muslim guy,hates british <sep> moves to london,hates british <sep> moves to london
16,sassy black woman,"<emp> <sep> SON, WHY DIDN'T YOU STEAL THAT?","<emp> <sep> SON, WHY DIDN'T YOU STEAL THAT?"
253,mexicans on a truck,we have to get across the border <sep> in time for the 2016 election,we have to get across the border <sep> in time for the 2016 election
28,black kid,OLD PIC OF JAY-Z <sep> <emp>,OLD PIC OF JAY-Z <sep> <emp>
244,feminist cunt,I want full equality in physically tough jobs <sep> Women should have easier physical tests,I want full equality in physically tough jobs <sep> Women should have easier physical tests
85,nice white girl,stop being mean to me <sep> i'm trying really hard,stop being mean to me <sep> i'm trying really hard
50,feminist cunt,Equality for women!!! <sep> laughs at other feminists who think that men deserve the same,Equality for women!!! <sep> laughs at other feminists who think that men deserve the same
217,american flag shotgun guy,THE UNIVERSE <sep> DOES NOT EXIST,THE UNIVERSE <sep> DOES NOT EXIST
231,y u so arab,women <sep> why do you not stop trying to drive?!,women <sep> why do you not stop trying to drive?!
296,nia china,Being a nice person <sep> Does not mean being stupid,Being a nice person <sep> Does not mean being stupid
272,nia china,KEEP CALM <sep> AND PENETRATE CHINA!,KEEP CALM <sep> AND PENETRATE CHINA!
51,jewish dude,I Got Punched In The Face At A bar mitzvah <sep> BY MY COUSIN WHOSE bar mitzvah IT WAS,I Got Punched In The Face At A bar mitzvah <sep> BY MY COUSIN WHOSE bar mitzvah IT WAS
0,skeptical black kid,So You're telling me <sep> You eat too much and you want to lose weight?,So You're telling me <sep> You eat too much and you want to lose weight?
273,transvestite trevor,I'm looking for Nikhil <sep> Can you find him please,I'm looking for Nikhil <sep> Can you find him please
128,germany pls,"speak a language considered good for swearing in <sep> everyone says ""fuck""","speak a language considered good for swearing in <sep> everyone says ""fuck"""
152,muslim immigrant,but i said alvin is like my brother <sep> you must accept me,but i said alvin is like my brother <sep> you must accept me
112,like a jew,"cashier says ""merry christmas"" <sep> demands multiculturalism","cashier says ""merry christmas"" <sep> demands multiculturalism"
222,advicejew,you pay taxes <sep> because of us,you pay taxes <sep> because of us
11,american pride eagle,a promise to me <sep> was broken,a promise to me <sep> was broken
23,black kid,MY MOM NAMED ME <sep> PRINCESS.,MY MOM NAMED ME <sep> PRINCESS.
254,arabic meme,Do I got something in my teeth <sep> ,Do I got something in my teeth <sep> 
143,mexicanotriste,MADE IT THROUGH THE ANGLESEY BORDER <sep> NOT BAD,MADE IT THROUGH THE ANGLESEY BORDER <sep> NOT BAD
72,strict policeman,studies criminal justice <sep> police academy teaches him everything,studies criminal justice <sep> police academy teaches him everything
158,muslim immigrant,LET US IN THEY SAID <sep> WE'LL BE NICE THEY SAID,LET US IN THEY SAID <sep> WE'LL BE NICE THEY SAID
141,white power problems,"wants to defend ""white tradition"" <sep> lives in NY and eats at mcdonalds","wants to defend ""white tradition"" <sep> lives in NY and eats at mcdonalds"
25,black kid,IT DONT MATTER <sep> IF YOUR BLACK OR WHITE!,IT DONT MATTER <sep> IF YOUR BLACK OR WHITE!
117,stern but honest chinese guy,Brainwashing caused all our problems <sep> so we need more brainwashing,Brainwashing caused all our problems <sep> so we need more brainwashing
284,obese american,hates big government <sep> gets social security,hates big government <sep> gets social security
267,policeman,If you don't want to be shot by police <sep> Have you tried not attacking them?,If you don't want to be shot by police <sep> Have you tried not attacking them?
22,black kid,GIRLS THINK I'M SEXY <sep> <emp>,GIRLS THINK I'M SEXY <sep> <emp>
129,obese american,"If you just work hard, you'll succeed! <sep> works 70 hour weeks, lives in a trailer","If you just work hard, you'll succeed! <sep> works 70 hour weeks, lives in a trailer"
151,strict policeman,calls you a pedophile <sep> trades child porn on the internet,calls you a pedophile <sep> trades child porn on the internet
286,privilege abusing white couple,Wedding day <sep> This Friday,Wedding day <sep> This Friday
142,american flag shotgun guy,They Took <sep> our jobs!!!,They Took <sep> our jobs!!!
277,mexicanotriste,"Obama lied to me <sep> Said I could vote, but now I go to jail","Obama lied to me <sep> Said I could vote, but now I go to jail"
88,nice white girl,why are black girls <sep> so loud?,why are black girls <sep> so loud?
136,privilege abusing white couple,Asian dressed in black <sep> Are you a ninja?,Asian dressed in black <sep> Are you a ninja?
163,success germany,zero tolerance on <sep> douche bags,zero tolerance on <sep> douche bags
232,richarabclap,Akhmed El Codoor <sep> Approves this Picture,Akhmed El Codoor <sep> Approves this Picture
184,typical germany lover,Germany! <sep> always fun to watch,Germany! <sep> always fun to watch
239,scumbag police officer,I couldn't but help notice you have a brake light out <sep> ,I couldn't but help notice you have a brake light out <sep> 
223,confused muslim girl,Complain about the system <sep> Doesn't cooperate in order to receive benefits,Complain about the system <sep> Doesn't cooperate in order to receive benefits
246,typical germany lover,Is stopped twice from taking over Europe <sep> now controls the Euro-Zone,Is stopped twice from taking over Europe <sep> now controls the Euro-Zone
279,angry muslim guy,Oh SO That's what <sep> A Woman's Ears Look like,Oh SO That's what <sep> A Woman's Ears Look like
48,privilege denying feminist,wants Everything Equal <sep> Except for when the military draft comes,wants Everything Equal <sep> Except for when the military draft comes
76,muslim immigrant,how can we pray <sep> when the koran is burning,how can we pray <sep> when the koran is burning
264,typical germany lover,Susanne Lang <sep> Probably the best Technical translator in Germany,Susanne Lang <sep> Probably the best Technical translator in Germany
91,typical germany lover,fucked the world twice <sep> complains about immigrants,fucked the world twice <sep> complains about immigrants
198,oppressive trans bro,Won't get gender legally changed <sep> because he doesn't want to go to a men's prison,Won't get gender legally changed <sep> because he doesn't want to go to a men's prison
149,condescending christian,gets molested by church members <sep> still loves to go to church,gets molested by church members <sep> still loves to go to church
177,jewish dude,want to come <sep> with?,want to come <sep> with?
65,asian college freshman,Has a lockeroom <sep> needs no keys to open it,Has a lockeroom <sep> needs no keys to open it
297,feministfrequently,When you finally realize <sep> you need more t-shirts,When you finally realize <sep> you need more t-shirts
131,privilege abusing white couple,minority children deserve to be admitted <sep> into the best trade schools,minority children deserve to be admitted <sep> into the best trade schools
6,skeptical black kid,so you're telling me <sep> i can play xbox 6 of the 7 days of the week?,so you're telling me <sep> i can play xbox 6 of the 7 days of the week?
236,scumbag police officer,"85 in a 70? <sep> Oh, I didn't see that you're a beautiful blonde. Carry on ma'am","85 in a 70? <sep> Oh, I didn't see that you're a beautiful blonde. Carry on ma'am"
56,privilege denying tranny,I may not be able to milk my tits <sep> but i can sure milk my cock,I may not be able to milk my tits <sep> but i can sure milk my cock
261,american flag shotgun guy,you may take my sunshine <sep> But you'll never take my freedom,you may take my sunshine <sep> But you'll never take my freedom
249,oppressive trans bro,transmisogynist? <sep> but I fuck trans women all the time!,transmisogynist? <sep> but I fuck trans women all the time!
172,germany pls,spring is finally here <sep> the whole countryside is yellow,spring is finally here <sep> the whole countryside is yellow
12,american pride eagle,Gets into Debt <sep> Starts spreading freedom,Gets into Debt <sep> Starts spreading freedom
67,stern but honest chinese guy,You call it Chinese food <sep> we just call it food,You call it Chinese food <sep> we just call it food
262,mexicans on a truck,the down fall of america <sep> without firing a shot,the down fall of america <sep> without firing a shot
52,jesus christ,"Love one another* <sep> (Except faggots, they are gross)","Love one another* <sep> (Except faggots, they are gross)"
229,confused muslim girl,When your engineering group is way smarter than you <sep> ,When your engineering group is way smarter than you <sep> 
45,feministfrequently,I'm not a hypocrite <sep> i'm a woman,I'm not a hypocrite <sep> i'm a woman
201,bad advice asian,"#4 rule <sep> If he truly likes you, he'll forgive you.","#4 rule <sep> If he truly likes you, he'll forgive you."
204,jesus christ,when hugging <sep> always leave room for jesus,when hugging <sep> always leave room for jesus
259,mexicans on a truck,"all aboard <sep> next stop, Dodgers Stadium","all aboard <sep> next stop, Dodgers Stadium"
299,nia china,When your emperor <sep> Burns all the books at school,When your emperor <sep> Burns all the books at school
228,scumbag police officer,Racial profiling? <sep> I investigated myself and found I did nothing wrong,Racial profiling? <sep> I investigated myself and found I did nothing wrong
206,obese american,i don't know much about russia <sep> because i don't speak spanish,i don't know much about russia <sep> because i don't speak spanish
263,stern but honest chinese guy,The Linder-Green family should move to <sep> North Korea/DPRK,The Linder-Green family should move to <sep> North Korea/DPRK
189,scumbag catholic priest,Santa Claus doesn't exist <sep> is jesus who give you all those gifts,Santa Claus doesn't exist <sep> is jesus who give you all those gifts
8,american pride eagle,I find lack of energy in this mail group <sep> very disturbing,I find lack of energy in this mail group <sep> very disturbing
213,typical germany lover,KEEP CALM BRAZIL AND <sep> WE WILL KEEP IT SHORT AND TO THE POINT,KEEP CALM BRAZIL AND <sep> WE WILL KEEP IT SHORT AND TO THE POINT
258,policeman,When the police finds out <sep> You're Black,When the police finds out <sep> You're Black
44,feministfrequently,This background <sep> is sexist,This background <sep> is sexist
216,confused muslim girl,When you go to the beach and no one has a suit <sep> ,When you go to the beach and no one has a suit <sep> 
270,policeman,Once you start killing civilians for busted tail lights <sep> You are now a murderer,Once you start killing civilians for busted tail lights <sep> You are now a murderer
257,american flag shotgun guy, <sep> ain't scared of no tornado, <sep> ain't scared of no tornado
181,scumbag police officer,DON'T TEXT AND DRIVE <sep> HAS LAPTOP INSTALLED IN CAR,DON'T TEXT AND DRIVE <sep> HAS LAPTOP INSTALLED IN CAR
183,good chinese student,Fights off robber with fly spray <sep> Good for controlling pests,Fights off robber with fly spray <sep> Good for controlling pests
290,jesus christ,JESUS IS <sep> WATCHING YOU,JESUS IS <sep> WATCHING YOU
268,richarabclap,AND YOUR COWORKER <sep> LOVES IT,AND YOUR COWORKER <sep> LOVES IT
250,mexicans on a truck,"Natives be like <sep> On our way to the state games,save us a spot.","Natives be like <sep> On our way to the state games,save us a spot."
75,obese american,That awkward moment when Mr. Madaris forgets his lunch at home <sep> ,That awkward moment when Mr. Madaris forgets his lunch at home <sep> 
283,confused muslim girl,When your husband would rather <sep> fuck his goat right in the pussy instead of you,When your husband would rather <sep> fuck his goat right in the pussy instead of you
190,scumbag police officer,Says speeding is dangerous <sep> speeds anyway without reason,Says speeding is dangerous <sep> speeds anyway without reason
202,oppressive trans bro,these fucking cunts <sep> are so hysterical,these fucking cunts <sep> are so hysterical
165,jewish dude,i eat bacon <sep> when no one's looking,i eat bacon <sep> when no one's looking
55,privilege denying tranny,i'm more of a woman than you <sep> i had to fight to be a woman,i'm more of a woman than you <sep> i had to fight to be a woman
221,policeman,come here!! <sep> ,come here!! <sep> 
92,mexicanotriste,"Uncle told me he misses you, adrian. <sep> come back to cuba.","Uncle told me he misses you, adrian. <sep> come back to cuba."
34,generic indian guy,1 pound fish <sep> very very cheap,1 pound fish <sep> very very cheap
110,good chinese student,what ever <sep> ,what ever <sep> 
147,privilege denying tranny,Special thanks to mr futch <sep> for funding the dragqueen eutopia,Special thanks to mr futch <sep> for funding the dragqueen eutopia
167,bad advice asian,not my fault <sep> it was poorly designed,not my fault <sep> it was poorly designed
224,confused muslim girl,When they ask Omar.. <sep> You are VEGETARIAN?!,When they ask Omar.. <sep> You are VEGETARIAN?!
78,advicejew,Life got you down? <sep> Would it kill you to call your mother?,Life got you down? <sep> Would it kill you to call your mother?
41,jesus christ,The Technique <sep> will save you,The Technique <sep> will save you
37,advicejew,SEE THIS HAT <sep> THRIFT STORE,SEE THIS HAT <sep> THRIFT STORE
31,generic indian guy,buys expensive guns <sep> cant afford shoes,buys expensive guns <sep> cant afford shoes
291,nia china,well actually <sep> this is how you tie a tie,well actually <sep> this is how you tie a tie
127,success germany,lost 2 world wars <sep> still thinks they are the best,lost 2 world wars <sep> still thinks they are the best
126,y u so arab,you can do whatever you want <sep> but we're having dinner,you can do whatever you want <sep> but we're having dinner
247,scumbag catholic priest,A Priest ! <sep> Hide the children !,A Priest ! <sep> Hide the children !
130,privilege abusing white couple,global warming is really bad <sep> for property values on cape cod,global warming is really bad <sep> for property values on cape cod
